id,lemma,V1 frame,UMR,synset_id,URI lemma,roles,example,definition,notes,gramm_info,additional notes (not for processing),,
Par. 41,,,,,,,,,,,,,
SlaT-3136-n2,habeo,v#v-w73_MPf64_MP,habeo-NEW-25,v#02681795,105044,"ACT, PAT, EFF","Allobroges diu in incerto habuere, quidnam consili caperent","keep in a certain state, position, or activity; e.g.,",,,,,
SlaT-3136-n6,capio,v#v-w106_MPf10_MP,decido-02,v#00697589,98060,"ACT, PAT","Allobroges diu in incerto habuere, quidnam consili caperent",,single predicate capere consilium (light verb construction). verbal frame for capio only: capio-06,,,,
SlaT-3136-n8,consilium,v#v-w316_MPf1_MP,,,,,,,,,,,
SlaT-3137-n1,sum,v#v-w2_MPf102_MP,have-place-91,,,,,,,,,,
SlaT-3137-n6,alienus,v#v-w1336_MPf3_MP,,,,,,,NON-EVENT,,,,
SlaT-3137-n7,studium,v#v-w59_MPf8_MP,,,,,,,NON-EVENT,,,,
3138a1,sum,v#v-w2_MPf112_MP,have-place-91,,,,,,,,,,
SlaT-3138-n6,consilium,v#v-w316_MPf1_MP,,,,,,,NON-EVENT,,,,
SlaT-3138-n7,tueor,v#v-w653_MPf3_MP,tueor-06/tueor-07/tueor-14,v#01128193/v#01129337/v#02280132,129187,"ACT, PAT",tutae tranquillaeque res omnes,,NON-EVENT,,tutus safe,,
SlaT-3139-n1,vinco,v#v-w143_MPf4_MP,uinco-04,v#01105639,130232,"ACT, PAT",tandem vicit fortuna rei publicae,,,,,,
SlaT-3139-n2,volvo,v#v-w798_MPf3_MP,uoluo-02,v#00630380,130766,"ACT, PAT",haec illis volventibus,,,,,,
SlaT-3140-n1,aperio,v#v-w699_MPf7_MP,aperio-03,v#00933821,89397,"ACT, PAT","Q. Fabio Sangae [...] rem omnem, uti cognoverant, aperiunt",,,,,,
SlaT-3140-n7,utor,v#v-w28_MPf6_MP,utor-08,v#02290461,130923,"ACT, PAT","Q. Fabio Sangae, cuius patrocinio civitas plurumum utebatur, rem omnem [....] aperiunt",,,PAT in ablative,,,
SlaT-3140-n14,cognosco,v#v-w118_MPf25_MP,cognosco-03,v#00594621,94738,"ACT, PAT","Q. Fabio Sangae [...] rem omnem, uti cognoverant, aperiunt",,,,,,
SlaT-3141-n1,praecipio,v#v-w171_MPf4_MP,praecipio-03,v#00747135,118735,"ACT, EFF, PAT",Cicero per Sangam consilio cognito legatis praecipit,,,,,,
SlaT-3141-n3,cognosco,v#v-w118_MPf24_MP,cognosco-03,v#00594621,94738,"ACT, PAT",Cicero per Sangam consilio cognito legatis praecipit,,,,,,
SlaT-3141-n5,consilium,v#v-w316_MPf1_MP,,,,,,,NON-EVENT,,,,
SlaT-3141-n8,simulo,v#v-w850_MPf2_MP,simulo-NEW-01,v#00838043,124866,"ACT, PAT","legatis praecipit, ut studium coniurationis vehementer simulent",make believe with the intent to deceive,,,,,
SlaT-3141-n9,studium,v#v-w59_MPf8_MP,,,,,,,NON-EVENT,,,,
SlaT-3141-n10,conjuratio,v#v-w1094_MPf4_MP,coniuratio-05,n#05908882,95954,ACT,de superiore coniuratione satis dictum,,NON-EVENT,,,,
SlaT-3141-n12,adeo,v#v-w933_MPf3_MP,adeo2-03,v#01844048,87421,"ACT, PAT",ceteros adeant,,,,,,
SlaT-3141-n14,polliceor,v#v-w822_MPf6_MP,polliceor-01/polliceor-02,v#00884317/v#00889555,118296,"ACT, ADDR, PAT",bene polliceantur,,merge,,,,
SlaT-3141-n16,do,v#v-w72_MPf26_MP,nitor-06,v#02531199,113708,"ACT, PAT","dentque operam, uti eos quam maxume manufestos habeant",,,,"if to create a new entry: do-operam-NEW-02, with same synset (attempt by employing effort)",,
SlaT-3141-n18,habeo,v#v-w73_MPf65_MP,habeo-NEW-25,v#02681795,105044,"ACT, PAT, EFF","dentque operam, uti eos quam maxume manufestos habeant","keep in a certain state, position, or activity; e.g.,",,,,,
Par. 42,,,,,,,,,,,,,
SlaT-3142-n1,sum,v#v-w2_MPf128_MP,have-place-91,,,,,,,,,,
SlaT-3142-n17,motus,v#v-w274_MPf4_MP,moueo-05,v#00520019,112848,"ACT, PAT",in agro Piceno Bruttio Apulia motus erat.,,EVENT,,,,
SlaT-3143-n2,ago,v#v-w250_MPf17_MP,08-17,v#02367363,88140,"ACT, PAT",inconsulte ac veluti per dementiam cuncta simul agebant,,,,,,
SlaT-3143-n5,dimitto,v#v-w649_MPf8_MP,dimitto-07,v#01955127,99509,"ACT, PAT","illi, quos ante Catilina dimiserat",,,,,,
SlaT-3144-n1,efficio,v#v-w476_MPf7_MP,efficio-11/efficio-18,v#01645601/v#01752884,100627,"ACT, PAT",plus timoris quam periculi effecerant,,,,,,
SlaT-3144-n3,consilium,v#v-w316_MPf1_MP,conuoco-03/conuoco-04/conuoco-05,v#00793037/v#01380638/v#02598143,96487,"ACT, PAT",nocturnis consiliis,,EVENT,,riunione,,
SlaT-3144-n5,portatio,v#v-w1337_MPf1_MP,porto-04,v#01449974,118540,"ACT, DIR3, PAT",armorum atque telorum portationibus,,EVENT,,,,
SlaT-3144-n10,festino,v#v-w860_MPf4_MP,festino-02,v#00459498,103186,ACT,festinando agitando omnia,,,,,,
SlaT-3144-n11,agito,v#v-w631_MPf5_MP,agito-09,v#01889610,88103,"ACT, PAT",festinando agitando omnia,,,,does not match with same frame elsewhere,,
SlaT-3144-n14,timor,v#v-w1104_MPf4_MP,timeo-01,v#01780202,128264,"ACT, PAT",plus timoris quam periculi effecerant,,EVENT,,,,
3144a4,efficio,v#v-w476_MPf7_MP,efficio-11/efficio-18,v#01645601/v#01752884,100627,"ACT, PAT",plus timoris quam periculi effecerant,,,,,,
SlaT-3145-n2,conjicio,v#v-w867_MPf4_MP,conicio-15,v#01494310,95917,,conpluris Q. Metellus Celer [...] in vincula coniecerat,,,,"se TWHEN è giusto, sostituirlo. l'alternativa è conicio-20, ma sembra meno adatto (più letterale)",,Eleonora
SlaT-3145-n13,cognosco,v#v-w118_MPf24_MP,cognosco-10,v#02154508,94738,"ACT, PAT",causa cognita,,,,,,
SlaT-3145-n14,causa,v#v-w258_MPf3_MP,,,,,,,NON-EVENT,,,,
3145a3,conjicio,v#v-w867_MPf4_MP,conicio-15,v#01494310,95917,,conpluris Q. Metellus Celer [...] in vincula coniecerat,,,,"se TWHEN è giusto, sostituirlo.",,Eleonora
SlaT-3145-n22,praesum,v#v-w815_MPf3_MP,praesum-06,v#02586619,119265,"ACT, PAT","C. Murena, qui ei provinciae legatus praeerat",,,,,,
Par. 43,,,,,,,,,,,,,
SlaT-3146-n2,constituo,v#v-w605_MPf10_MP,constituo-07,v#00697589,96146,"ACT, PAT",constituerat uti [...] quereretur de actionibus Ciceronis,,,,,,
SlaT-3146-n6,sum,v#v-w2_MPf100_MP,have-role-91,,,,,,,,,,
SlaT-3146-n9,conjuratio,v#v-w1094_MPf4_MP,coniuratio-05,n#05908882,95954,ACT,cetera multitudo coniurationis,,,,,,
SlaT-3146-n10,paro,v#v-w572_MPf10_MP,paro-01,v#00406243,116061,"ACT, PAT","paratis, uti videbatur, magnis copiis",,,,,,
SlaT-3146-n11,video,v#v-w16_MPf21_MP,uideo-11,v#02134672,130163,"ACT, EFF, PAT","paratis, uti videbatur, magnis copiis",,,passive,,,
SlaT-3146-n15,venio,v#v-w34_MPf13_MP,uenio-07,v#02005948,129790,"ACT, DIR1, DIR3",cum Catilina in agrum Faesulanum cum exercitu venisset,,,,,,
SlaT-3146-n25,habeo,v#v-w73_MPf19_MP,habeo-NEW-29,v#01733477,105044,"ACT, PAT",concione habita,organise or be responsible for,,,,,
SlaT-3146-n27,queror,v#v-w616_MPf5_MP,queror-05,v#00911350,121157,"ACT, PAT",quereretur de actionibus Ciceronis,,,,,,
SlaT-3146-n28,actio,v#v-w960_MPf2_MP,08-17,v#02367363,88140,"ACT, PAT",de actionibus Ciceronis,,,,,,
SlaT-3146-n30,impono,v#v-w369_MPf8_MP,impono-04,v#00748282,106633,"ACT, ADDR, PAT",bellique gravissimi invidiam optimo consuli imponeret,,,,,,
3147a2,constituo,v#v-w605_MPf10_MP,constituo-07,v#00697589,96146,"ACT, PAT",constituerat uti [...] quereretur de actionibus Ciceronis,,,,,,
SlaT-3147-n1,exsequor,v#v-w848_MPf2_MP,exsequor-06,v#01712704,102311,"ACT, PAT",suum quisque negotium exsequeretur,,,,,,
SlaT-3147-n5,proximus,v#v-w1036_MPf4_MP,,,,,,,NON-EVENT,,,,
SlaT-3147-n8,conjuratio,v#v-w1094_MPf4_MP,coniuratio-05,n#05908882,95954,ACT,cetera multitudo coniurationis,,,,,,
SlaT-3148-n2,dico,v#v-w9_MPf74_MP,dico2-21,v#01016002,99302,"ACT, PAT",ea divisa hoc modo dicebantur,,,,,,
SlaT-3148-n4,divido,v#v-w510_MPf2_MP,diuido-16,v#02031158,99932,"ACT, PAT",ea divisa hoc modo dicebantur,,,,,,
3149a1,dico,v#v-w9_MPf86_MP,dico2-21,v#01016002,99302,"ACT, PAT",ea divisa hoc modo dicebantur,,,,,,
SlaT-3149-n1,incendo,v#v-w762_MPf6_MP,incendo-06,v#02761372,106911,"ACT, PAT",Statilius et Gabinius uti cum magna manu duodecim simul opportuna loca urbis incenderent,,,,,,
SlaT-3149-n12,fio,v#v-w565_MPf15_MP,fio-01,v#00149583,103328,"ACT, PAT","facilior aditus ad consulem ceterosque, quibus insidiae parabantur, fieret",,,,"I thought EFF was necessary (in V1 there's ACT, PAT, EFF as obl), but compare with Czech Vallex, both PDT and non-PDT: stá(va)t se has ACT, PAT; example: stal se z chlapce mužem; s. se majitelem krásné ženy",,
SlaT-3149-n15,aditus,v#v-w1058_MPf4_MP,adeo2-04,v#02053941,87421,"ACT, DIR3","facilior aditus ad consulem ceterosque, quibus insidiae parabantur, fieret",,,,,,
SlaT-3149-n19,paro,v#v-w572_MPf17_MP,paro-07,v#01638368,116061,"ACT, PAT","facilior aditus ad consulem ceterosque, quibus insidiae parabantur, fieret",,,,,,
3150a1,dico,v#v-w9_MPf86_MP,dico2-21,v#01016002,99302,"ACT, PAT",ea divisa hoc modo dicebantur,,,,,,
SlaT-3150-n3,obsido,v#v-w1270_MPf2_MP,obsido-03,v#01126700,114432,"ACT, PAT",Cethegus Ciceronis ianvam obsideret,,,,,,
SlaT-3150-n6,aggredior,v#v-w779_MPf4_MP,aggredior-05,v#01120069,88082,"ACT, PAT",eumque vi adgrederetur,,,,,,
3151a1,dico,v#v-w9_MPf86_MP,dico2-21,v#01016002,99302,"ACT, PAT",ea divisa hoc modo dicebantur,,,,,,
3151a2,interficio,v#v-w604_MPf5_MP,interficio-01,v#01323958,108471,"ACT, PAT","filii familiarum, quorum nobilitate pars maxuma erat, parentes interficerent",,,,,,
SlaT-3151-n5,interficio,v#v-w604_MPf3_MP,interficio-01,v#01323958,108471,"ACT, PAT","filii familiarum, quorum nobilitate pars maxuma erat, parentes interficerent",,,,,,
SlaT-3151-n8,sum,v#v-w2_MPf133_MP,abstract,,,,,,,,"nobilitas can be a social-group, but which predicate? Again, something like be-member-91",,
3152a1,dico,v#v-w9_MPf86_MP,dico2-21,v#01016002,99302,"ACT, PAT",ea divisa hoc modo dicebantur,,,,,,
SlaT-3152-n1,erumpo,v#v-w911_MPf3_MP,erumpo-NEW-16,v#02015031,101488,"ACT, DIR3",ad Catilinam erumperent,"set out in a sudden, energetic or violent manner",,,,,
SlaT-3152-n3,percello,v#v-w1152_MPf3_MP,percello-05,v#01770501,116645,"ACT, PAT",caede et incendio perculsis omnibus,,,,,,
SlaT-3153-n1,queror,v#v-w616_MPf5_MP,queror-05,v#00911350,121157,"ACT, PAT",Cethegus semper querebatur de ignavia sociorum,,,,does not match with same frame elsewhere,,
SlaT-3153-n4,paro,v#v-w572_MPf4_MP,paro-07,v#01638368,116061,"ACT, PAT",inter haec parata atque decreta,,,,,,
SlaT-3153-n5,decerno,v#v-w635_MPf10_MP,decerno-02,v#00697589,98047,"ACT, PAT",inter haec parata atque decreta,,,,,,
3154a1,queror,v#v-w616_MPf6_MP,queror-05,v#00911350,121157,"ACT, PAT",Cethegus semper querebatur de ignavia sociorum,,,,,,
SlaT-3154-n1,corrumpo,v#v-w514_MPf6_MP,corrumpo-13,v#02527651,96706,"ACT, PAT",magnas opportunitates corrumpere,,,,,,
SlaT-3154-n4,dubito,v#v-w608_MPf5_MP,dubito-05,v#02640440,100176,"ACT, PAT",dubitando et dies prolatando,,,,does not match with same frame elsewhere,,
SlaT-3154-n5,prolato,v#v-w1338_MPf1_MP,prolato-04,v#02642814,119782,"ACT, PAT",dubitando et dies prolatando,,,,,,
3155a1,queror,v#v-w616_MPf6_MP,queror-05,v#00911350,121157,"ACT, PAT",Cethegus semper querebatur de ignavia sociorum,,,,,,
SlaT-3155-n5,opus,v#v-w1019_MPf3_MP,opus-est-NEW-01,v#01188725,115170,"ACT, PAT","facto, non consulto [...] opus est",have need of,,,"I would not use this frame, but either an abstract predicate (so far not existing) or an equivalent of smth like need-01, verbal, che però in latino non sembra esistere. what about opus-est-01? former opus-23.",,
SlaT-3155-n7,facio,v#v-w76_MPf30_MP,facio-02,v#00014549,102758,ACT,"facto, non consulto [...] opus est",,,,,,
SlaT-3155-n8,consulo,v#v-w630_MPf7_MP,consulo-04,v#00699626,96186,ACT,"facto, non consulto [...] opus est",,,,different frame than other consulo-04,,
SlaT-3155-n10,facio,v#v-w76_MPf24_MP,facio-23,v#01712704,102758,"ACT, PAT",impetum in curiam facturum,,,,,,
SlaT-3155-n12,adjuvo,v#v-w791_MPf2_MP,adiuuo-02,v#02547586,87510,ACT,si pauci adiuvarent,,,,,,
SlaT-3155-n14,langueo,v#v-w1339_MPf2_MP,langueo-05,v#02417504,109831,ACT,languentibus aliis,,,,,,
SlaT-3156-n2,sum,v#v-w2_MPf99_MP,have-mod-91,,,,,,,,,,
SlaT-3156-n9,puto,v#v-w145_MPf7_MP,puto-09,v#00689344,120610,"ACT, PAT",maxumum bonum in celeritate putabat,,,,,,
Par. 44,,,,,,,,,,,,,
SlaT-3157-n2,convenio,v#v-w93_MPf31_MP,conuenio-NEW-15,v#02240481,96424,"ACT, PAT",Allobroges [...] ceteros conveniunt,try to get or reach,,,,,
SlaT-3158-n1,postulo,v#v-w768_MPf6_MP,postulo-01,v#00752764,118629,"ACT, ADDR, PAT","ab Lentulo, Cethego, Statilio, item Cassio postulant ius iurandum",,,,,,
SlaT-3158-n9,iuro,v#v-w903_MPf3_MP,iuro-05,v#00889947,109249,"ACT, PAT","ius iurandum, quod signatum ad civis perferant",,,,,,
SlaT-3158-n10,perfero,v#v-w695_MPf5_MP,perfero-10,v#01449974,116816,"ACT, ADDR, DIR1, DIR3, PAT","ius iurandum, quod signatum ad civis perferant",,,,,,
SlaT-3158-n12,signo,v#v-w543_MPf1_MP,signo-09,v#01356582 ,124766,"ACT, PAT","ius iurandum, quod signatum ad civis perferant",,,,,,
3159a1,postulo,v#v-w768_MPf8_MP,postulo-01,v#00752764,118629,"ACT, ADDR, PAT","ab Lentulo, Cethego, Statilio, item Cassio postulant ius iurandum",,,,,,
SlaT-3159-n1,impello,v#v-w671_MPf9_MP,impello-08/impello-11,v#01650425/v#02506546,106498,"ACT, ADDR, PAT",aliter haud facile eos ad tantum negotium inpelli posse,,merge,,different frame than other impello-08/impello-11,,
SlaT-3160-n2,do,v#v-w72_MPf30_MP,do-04,v#00806049,99970,"ACT, ADDR, PAT",ceteri nihil suspicantes dant,,,,,,
SlaT-3160-n4,suspicor,v#v-w134_MPf3_MP,suspicor-04,v#00687926,127134,"ACT, PAT",ceteri nihil suspicantes dant,,,,,,
SlaT-3160-n6,polliceor,v#v-w822_MPf3_MP,polliceor-01/polliceor-02,v#00884317/v#00889555,118296,"ACT, ADDR, PAT",Cassius semet eo brevi venturum pollicetur,,merge,,,,
SlaT-3160-n8,venio,v#v-w34_MPf9_MP,uenio-07,v#02005948,129790,"ACT, DIR1, DIR3",Cassius semet eo brevi venturum pollicetur,,,,,,
SlaT-3160-n12,proficiscor,v#v-w645_MPf15_MP,proficiscor-07,v#02009433,119713,ACT,ex urbe proficiscitur,,,,,,
SlaT-3161-n1,mitto,v#v-w228_MPf36_MP,mitto-18,v#01955127,112499,"ACT, INTT, PAT",T. Volturcium quendam Crotoniensem mittit,,,,different frame than other mitto-18,,
SlaT-3161-n9,confirmo,v#v-w206_MPf13_MP,confirmo-01,v#00165450,95765,"ACT, PAT",societatem confirmarent,,,,,,
SlaT-3161-n12,pergo,v#v-w743_MPf2_MP,pergo-02,v#01995549,116892,"ACT, DIR3",prius quam domum pergerent,,,,,,
SlaT-3161-n15,do,v#v-w72_MPf20_MP,do-28,v#02294436,99970,"ACT, ADDR, PAT",cum Catilina data atque accepta fide,,,,different frame than other do-28,,
SlaT-3161-n16,accipio,v#v-w217_MPf33_MP,accipio-16,v#02236124,87119,"ACT, ORIG, PAT",cum Catilina data atque accepta fide,,,,different frame than other accipio-16,,
SlaT-3162-n1,do,v#v-w72_MPf24_MP,do-20,v#02230772,99970,"ACT, ADDR, PAT",ipse Volturcio litteras ad Catilinam dat,,,,,,
SlaT-3162-n6,scribo,v#v-w603_MPf6_MP,scribo-03,v#01000214,123840,"ACT, PAT",litteras [...] quarum exemplum infra scriptum est,,,,,,
SlaT-3163-n1,cognosco,v#v-w118_MPf25_MP,cognosco-06,v#00598954,94738,"ACT, PAT","qui sim, ex eo, quem ad te misi, cognosces",,,,,,
SlaT-3163-n2,sum,v#v-w2_MPf119_MP,have-identity-91,,,,,,,,,,
SlaT-3163-n5,mitto,v#v-w228_MPf11_MP,mitto-18,v#01955127,112499,"ACT, INTT, PAT","ex eo, quem ad te misi",,,,different frame than other mitto-18,,
SlaT-3164-n1,facio,v#v-w76_MPf54_MP,facio-23,v#01712704,102758,"ACT, PAT","fac cogites, in quanta calamitate sis",,,,,,
SlaT-3164-n3,cogito,v#v-w185_MPf19_MP,cogito2-04,v#00629889,97288,"ACT, REG","fac cogites, in quanta calamitate sis",,,,,,
SlaT-3164-n4,sum,v#v-w2_MPf128_MP,have-place-91,,,,,,,,,,
SlaT-3164-n7,memini,v#v-w1340_MPf1_MP,memini-02/memini-03,v#00609506/v#00609683,111991,"ACT, PAT",memineris te virum esse,,merge,,,,
SlaT-3164-n8,sum,v#v-w2_MPf100_MP,have-identity-91,,,,,,,,,,
3165a1,facio,v#v-w76_MPf54_MP,facio-23,v#01712704,102758,"ACT, PAT","fac cogites, in quanta calamitate sis",,,,,,
SlaT-3165-n1,considero,v#v-w27_MPf11_MP,considero-03,v#00711715,96054,"ACT, PAT","consideres, quid tuae rationes postulent",,,,,,
SlaT-3165-n2,postulo,v#v-w768_MPf12_MP,postulo-06,v#01188725,118629,"ACT, PAT","consideres, quid tuae rationes postulent",,,,,,
3166a1,facio,v#v-w76_MPf54_MP,facio-23,v#01712704,102758,"ACT, PAT","fac cogites, in quanta calamitate sis",,,,,,
SlaT-3166-n1,peto,v#v-w564_MPf8_MP,peto-03,v#00752493,117549,"ACT, ADDR, PAT",auxilium petas ab omnibus,,,,,,
SlaT-3166-n2,auxilium,v#v-w1110_MPf6_MP,auxilior-03,v#02547586,,"ACT, PAT",auxilium petas ab omnibus,,,,,,
SlaT-3167-n1,do,v#v-w72_MPf32_MP,do-02,v#00742320,99970,"ACT, ADDR, PAT",ad hoc mandata verbis dat,,,,,,
SlaT-3167-n3,mando,v#v-w788_MPf5_MP,mando-01,v#00746718,111470,"ACT, ADDR, PAT",ad hoc mandata verbis dat,,,,,,
3168a1,do,v#v-w72_MPf33_MP,do-02,v#00742320,99970,"ACT, ADDR, PAT",ad hoc mandata verbis dat,,,,,,
SlaT-3168-n1,repudio,v#v-w1341_MPf1_MP,repudio-04,v#00796976,122688,"ACT, PAT",quo consilio servitia repudiet?,,,,,,
SlaT-3168-n2,iudico,v#v-w456_MPf6_MP,iudico-10,v#00822367,109171,"ACT, REG",ab senatu hostis iudicatus sit,,"Eleonora: V1 ha (ragionevolmente) ACT(obl), PAT(obl), EFF(obl). solo 1 frame in V2 ha eff (deem to be). quello che si avvicina di più è 10. come concilio?",,,,
SlaT-3168-n5,consilium,v#v-w316_MPf1_MP,,,,,,,NON-EVENT,,,,
3169a1,do,v#v-w72_MPf13_MP,do-02,v#00742320,99970,"ACT, ADDR, PAT",ad hoc mandata verbis dat,,,,,,
SlaT-3169-n1,sum,v#v-w2_MPf111_MP,have-mod-91,,,,,,,,,,
SlaT-3169-n3,paro,v#v-w572_MPf4_MP,paro-01,v#00406243,116061,"ACT, PAT",in urbe parata esse quae iusserit,,,,,,
SlaT-3169-n4,iubeo,v#v-w563_MPf4_MP,iubeo-02/iubeo-04,v#00746718/v#00747135,109152,"ACT, ADDR, PAT",in urbe parata esse quae iusserit,,merge,,,,
3170a1,do,v#v-w72_MPf34_MP,do-02,v#00742320,99970,"ACT, ADDR, PAT",ad hoc mandata verbis dat,,,,,,
SlaT-3170-n1,cunctor,v#v-w1342_MPf1_MP,cunctor-04,v#02058590,97248,ACT,ne cunctetur ipse propius adcedere,,"Eleonora: V1 ha (ragionevolmente) ACT(obl), PAT(obl). solo 1 frame in V2 ha PAT, ma altro significato. che faccio?",,,,
SlaT-3170-n3,accedo,v#v-w75_MPf7_MP,accedo-05/accedo-06,v#01992503/v#01994288,87084,"ACT, DIR3",ne cunctetur ipse propius adcedere,,,,,,
Par. 45,,,,,,,,,,,,,
SlaT-3171-n1,impero,v#v-w601_MPf6_MP,impero-03,v#00747135,106539,"ACT, ADDR, PAT","L. Valerio Flacco et C. Pomptino praetoribus imperat, ut in ponte Muluio per Allobrogum comitatus deprehendant",,,,different frame than other impero-03,,
SlaT-3171-n2,ago,v#v-w250_MPf19_MP,ago-17,v#02367363,88140,"ACT, PAT",his rebus ita actis,,,,,,
SlaT-3171-n6,constituo,v#v-w605_MPf11_MP,constituo-22,v#01647543,96146,"ACT, PAT",constituta nocte qua proficiscerentur,,,,,,
SlaT-3171-n8,proficiscor,v#v-w645_MPf16_MP,proficiscor-06/proficiscor-07/proficiscor-08,v#02008396/v#02009433/v#02014165,119713,ACT,constituta nocte qua proficiscerentur,,,,,,
SlaT-3171-n11,edoceo,v#v-w553_MPf4_MP,edoceo-03,v#00873682,100579,"ACT, ADDR, PAT",Cicero per legatos cuncta edoctus,,,,,,
SlaT-3171-n23,deprehendo,v#v-w797_MPf2_MP,deprehendo-07,v#01215137,98781,"ACT, PAT","L. Valerio Flacco et C. Pomptino praetoribus imperat, ut in ponte Muluio per Allobrogum comitatus deprehendant",,,,,,
SlaT-3172-n1,aperio,v#v-w699_MPf4_MP,aperio-03,v#00933821,89397,"ACT, PAT",rem omnem aperit,,,,,,
SlaT-3172-n4,mitto,v#v-w228_MPf37_MP,mitto-18,v#01955127,112499,"ACT, INTT, PAT","rem omnem aperit, cuius gratia mittebantur",,,,,,
SlaT-3173-n1,permitto,v#v-w107_MPf6_MP,permitto-07,v#02423183,117085,"ACT, EFF, PAT","cetera, uti facto opus sit, ita agant permittit",,,,,,
SlaT-3173-n2,ago,v#v-w250_MPf17_MP,ago-17,v#02367363,88140,"ACT, PAT","cetera, uti facto opus sit, ita agant permittit",,,,,,
SlaT-3173-n5,opus,v#v-w1019_MPf3_MP,opus-est-NEW-01,v#01188725,115170,"ACT, PAT",uti facto opus sit,have need of,,,"I would not use this frame, but either an abstract predicate (so far not existing) or an equivalent of smth like need-01, verbal, che però in latino non sembra esistere. what about opus-est-01? former opus-23.",,
SlaT-3173-n6,facio,v#v-w76_MPf30_MP,facio-02,v#00014549,102758,ACT,uti facto opus sit,,,,,,
SlaT-3174-n1,obsido,v#v-w1270_MPf3_MP,obsido-03,v#01126700,114432,"ACT, PAT",pontem obsidunt,,,,,,
SlaT-3174-n6,conloco,v#v-w1090_MPf3_MP,colloco-21,v#02333689,94872,"ACT, PAT",praesidiis conlocatis,,,,,,
SlaT-3174-n9,praecipio,v#v-w171_MPf5_MP,praecipio-03,v#00747135,118735,"ACT, EFF, PAT",sicuti praeceptum erat,,,,,,
SlaT-3175-n3,venio,v#v-w34_MPf15_MP,uenio-07,v#02005948,129790,"ACT, DIR1, DIR3",ad id loci legati cum Volturcio venerunt,,,,different frame than other uenio-07,,
SlaT-3175-n8,exorior,v#v-w1343_MPf1_MP,exorior-11,v#02625786,102103,"ACT, DIR1",clamor exortus est,,,,,,
SlaT-3175-n12,trado,v#v-w148_MPf10_MP,trado-05,v#01115585,128519,"ACT, ADDR, PAT",Galli [...] praetoribus se tradunt,,,,,,
SlaT-3175-n14,cognosco,v#v-w118_MPf24_MP,cognosco-06,v#00598954,94738,"ACT, PAT",cognito consilio,,,,,,
SlaT-3175-n15,consilium,v#v-w316_MPf1_MP,,,,,,,NON-EVENT,,,,
SlaT-3175-n20,defendo,v#v-w620_MPf4_MP,defendo-10,v#01129876,98236,"ACT, PAT",gladio se a multitudine defendit,,,,,,
SlaT-3175-n23,cohortor,v#v-w1039_MPf2_MP,cohortor-02,v#00771341,94757,"ACT, PAT",Volturcius primo cohortatus ceteros,,,,,,
SlaT-3175-n28,obtestor,v#v-w1300_MPf2_MP,obtestor-01,v#00759269,114498,"ACT, ADDR, PAT",multa prius de salute sua Pomptinum obtestatus,,,,,,
SlaT-3175-n30,desero,v#v-w626_MPf2_MP,desero-01,v#00614057,98882,"ACT, PAT",a legatis desertus est,,,,,,
SlaT-3175-n37,sum,v#v-w2_MPf111_MP,have-mod-91,,,,,,,,"better a single predicate nosco, passive",,
SlaT-3175-n38,nosco,v#v-w87_MPf13_MP,nosco-02,v#00594337,113840,"ACT, PAT",quod ei notus erat,,,,,,
SlaT-3175-n40,dedo,v#v-w790_MPf3_MP,dedo-03,v#01115585,98205,"ACT, ADDR, PAT",sese praetoribus dedit,,,,,,
SlaT-3175-n44,diffido,v#v-w1289_MPf2_MP,diffido-02,v#01810933,99348,"ACT, REG",vitae diffidens,,,,,,
3175a9,dedo,v#v-w790_MPf3_MP,dedo-03,v#01115585,98205,"ACT, ADDR, PAT",sese praetoribus dedit,,,,,,
Par. 46,,,,,,,,,,,,,
SlaT-3176-n1,declaro,v#v-w249_MPf6_MP,declaro-04,v#00965871,98090,"ACT, EFF, PAT",omnia propere per nuntios consuli declarantur,,,,,,
SlaT-3176-n2,conficio,v#v-w20_MPf3_MP,conficio-02,v#00484166,95742,"ACT, PAT",quibus rebus confectis,,,,,,
SlaT-3176-n7,nuntius,v#v-w1393_MPf2_MP,nuntio-07,v#00928630,114008,"ACT, ADDR, PAT",omnia propere per nuntios consuli declarantur,,if EVENT,,,,
SlaT-3177-n2,occupo,v#v-w595_MPf4_MP,occupo-08,v#01809321,114620,"ACT, PAT",illum ingens cura atque laetitia simul occupavere,,,,,,
SlaT-3177-n6,cura,v#v-w314_MPf1_MP,,,,,,,NON-EVENT,,,,
SlaT-3178-n1,laetor,v#v-w926_MPf2_MP,,,,,,,NON-EVENT,,,,
SlaT-3178-n3,intelligo,v#v-w117_MPf17_MP,intellego-04,v#00593522,108367,"ACT, PAT",laetabatur intellegens coniuratione patefacta civitatem periculis ereptam esse,,,,,,
SlaT-3178-n4,patefacio,v#v-w246_MPf4_MP,patefacio-02,v#00933821,116196,"ACT, PAT",coniuratione patefacta,,,,,,
SlaT-3178-n5,conjuratio,v#v-w1094_MPf4_MP,coniuratio-05,n#05908882,95954,ACT,,,,,,,
SlaT-3178-n6,eripio,v#v-w588_MPf5_MP,eripio-10,v#02551144,101432,"ACT, ORIG, PAT",civitatem periculis ereptam esse,,,,,,
SlaT-3179-n2,sum,v#v-w2_MPf99_MP,,,,,,,,,"not a distinct node, aux of ereptam",,
SlaT-3179-n5,dubito,v#v-w608_MPf6_MP,dubito-04,v#01831308,100176,"ACT, PAT",dubitans [...] quid facto opus esset,,,,,,
SlaT-3179-n13,opus,v#v-w1019_MPf3_MP,opus-est-NEW-01,v#01188725,115170,"ACT, PAT",uti facto opus sit,have need of,,,"I would not use this frame, but either an abstract predicate (so far not existing) or an equivalent of smth like need-01, verbal, che però in latino non sembra esistere. what about opus-est-01? former opus-23.",,
SlaT-3179-n14,facio,v#v-w76_MPf17_MP,facio-02,v#00014549,102758,ACT,uti facto opus sit,,,,,,
SlaT-3179-n7,deprehendo,v#v-w797_MPf3_MP,deprehendo-03,v#00725748,98781,"ACT, PAT",in maxumo scelere tantis civibus deprehensis,,,,,,
SlaT-3180-n1,credo,v#v-w146_MPf16_MP,credo-01,v#00631737,96881,"ACT, PAT",inpunitatem perdundae rei publicae fore credebat,,,,,,
3180a2,sum,v#v-w2_MPf227_MP,doppio dativo?,,,,,,,,,,
SlaT-3180-n7,sum,v#v-w2_MPf243_MP,doppio dativo?,,,,,,,,,,
SlaT-3180-n9,perdo,v#v-w533_MPf4_MP,perdo-02,v#01564144,116738,"ACT, PAT",inpunitatem perdundae rei publicae fore credebat,,,,,,
SlaT-3181-n1,iubeo,v#v-w563_MPf3_MP,iubeo-02/iubeo-04,v#00746718/v#00747135,109152,"ACT, ADDR, PAT",vocari ad sese iubet Lentulum,,merge,,,,
SlaT-3181-n4,confirmo,v#v-w206_MPf7_MP,confirmo-14,v#01766407,95765,"ACT, PAT",confirmato animo,,,,,,
SlaT-3181-n5,voco,v#v-w23_MPf7_MP,uoco-07,v#00792471,130729,"ACT, PAT",vocari ad sese iubet Lentulum,,,,,,
SlaT-3181-n15,paro,v#v-w572_MPf3_MP,paro-02,v#00406963,116061,"ACT, PAT",qui in Apuliam ad concitanda servitia proficisci parabat,,,,different frame than other paro-02,,
SlaT-3181-n17,proficiscor,v#v-w645_MPf11_MP,proficiscor-03,v#01835496,119713,"ACT, DIR1, DIR3",qui in Apuliam ad concitanda servitia proficisci parabat,,,,,,
SlaT-3181-n19,concito,v#v-w866_MPf4_MP,concito2-05,v#00851239,95535,"ACT, PAT",ad concitanda servitia,,,,,,
SlaT-3182-n1,venio,v#v-w34_MPf16_MP,uenio-07,v#02005948,129790,"ACT, DIR1, DIR3",ceteri sine mora veniunt,,,,,,
SlaT-3183-n1,profugio,v#v-w1344_MPf2_MP,profugio-02,v#02075049,119730,ACT,ex urbe profugerat,,,,,,
SlaT-3183-n3,egredior,v#v-w728_MPf2_MP,egredior-01,v#00528990,100715,"ACT, DIR1",domo egressus,,,,,,
SlaT-3183-n7,cognosco,v#v-w118_MPf24_MP,cognosco-06,v#00598954,94738,"ACT, PAT",cognito indicio,,,,,,
SlaT-3183-n8,indicium,v#v-w315_MPf4_MP,,,,,,,NON-EVENT,,,,
SlaT-3184-n4,perduco,v#v-w182_MPf13_MP,perduco-08,v#01999798,116747,"ACT, DIR1, DIR3, PAT",Lentulum [...] in senatum perducit,,,,,,
SlaT-3184-n6,sum,v#v-w2_MPf100_MP,have-role-91,,,,,,,,,,
SlaT-3184-n8,teneo,v#v-w172_MPf6_MP,teneo-11,v#01216670,127822,"ACT, PAT",manu tenens,,,,,,
SlaT-3184-n11,iubeo,v#v-w563_MPf10_MP,iubeo-02/iubeo-04,v#00746718/v#00747135,109152,"ACT, ADDR, PAT",reliquos cum custodibus in aedem Concordiae venire iubet,,merge,,,,
SlaT-3184-n13,venio,v#v-w34_MPf6_MP,uenio-07,v#02005948,129790,"ACT, DIR1, DIR3",reliquos cum custodibus in aedem Concordiae venire iubet,,,,,,
SlaT-3185-n4,advoco,v#v-w1345_MPf1_MP,aduoco-05,v#00793037,87719,"ACT, PAT",senatum advocat,,,,,,
SlaT-3185-n6,introduco,v#v-w103_MPf4_MP,introduco-07,v#02078591,109581,"ACT, DIR3, PAT",Volturcium cum legatis introducit,,,,,,
SlaT-3185-n13,iubeo,v#v-w563_MPf11_MP,iubeo-02/iubeo-04,v#00746718/v#00747135,109152,"ACT, ADDR, PAT",scrinium [...] eodem adferre iubet,,merge,,,,
SlaT-3185-n16,affero,v#v-w226_MPf9_MP,affero-07,v#02077656,88001,"ACT, DIR3, PAT",scrinium [...] eodem adferre iubet,,,,,,
SlaT-3185-n19,accipio,v#v-w217_MPf29_MP,accipio-14,v#02210119,87119,"ACT, ORIG, PAT","litteris, quas a legatis acceperat",,,,,,
Par. 47,,,,,,,,,,,,,
