SlaT-3292-n6,conscribo,v#v-w859_MPf5_MP,conscribo-07,v#02471327,95999,"ACT, PAT",patres conscripti,,,,,,
SlaT-3292-n8,capio,v#v-w106_MPf11_MP,capio-06,v#00674607,92686,"ACT, PAT",quo minus novom consilium capiamus,,,,"capio e facio: problema dei light verb construction. casi come dare poenas in cui è lessicalizzata abbastanza per  usare un altro verbo o creare una nuova entrata, e casi come questo (prendere provvedimenti, dove non lo è)",questo capio 06 è per il rotto della cuffia,
SlaT-3292-n9,consilium,v#v-w316_MPf1_MP,,,,,,,NON-EVENT,,,,
SlaT-3293-n1,sum,v#v-w2_MPf104_MP,have-mod-91,,,,,,,,"in realtà sarebbe un have-degree-91, sommando have-mod + maior",,
SlaT-3293-n16,facio,v#v-w76_MPf24_MP,facio-14,v#01617192,102758,"ACT, EFF, PAT",qui ex parvis opibus tantum imperium fecere,,,,,,
3293a1,sum,v#v-w2_MPf104_MP,have-mod-91,,,,,,,,"in realtà sarebbe il secondo ARG di have-degree-91, sommando have-mod + maior",,
SlaT-3293-n9,retineo,v#v-w248_MPf4_MP,retineo-05,v#02679899,122776,"ACT, PAT","nobis, qui ea bene parta vix retinemus",,,,,,
SlaT-3293-n12,pario,v#v-w746_MPf3_MP,pario2-08,v#02238770,116052,"ACT, PAT",ea bene parta,,,,,,
SlaT-3294-n1,placeo,v#v-w585_MPf7_MP,placeo-07,v#02291135,118010,"ACT, BEN",placet eos demitti et augeri exercitum Catilinae,,,,,,
SlaT-3294-n4,dimitto,v#v-w649_MPf10_MP,dimitto-13,v#02421374,99509,"ACT, PAT",placet eos demitti et augeri exercitum Catilinae,,,,,,
SlaT-3294-n6,augeo,v#v-w395_MPf10_MP,augeo-13/augeo-17/augeo-19/augeo-23,v#00229605/v#00263904/v#00434077/v#00555084,90673,"ACT, PAT",augeri exercitum Catilinae,,merge,,,,
3295a1,placeo,v#v-w585_MPf7_MP,placeo-07,v#02291135,118010,"ACT, BEN",placet eos demitti et augeri exercitum Catilinae,,,,,,
3295a4,dimitto,v#v-w649_MPf10_MP,dimitto-13,v#02421374,99509,"ACT, PAT",placet eos demitti et augeri exercitum Catilinae,,,,,,
3295a5,augeo,v#v-w395_MPf10_MP,augeo-13/augeo-17/augeo-19/augeo-23,v#00229605/v#00263904/v#00434077/v#00555084,90673,"ACT, PAT",augeri exercitum Catilinae,,merge,,,,
SlaT-3296-n2,censeo,v#v-w6_MPf6_MP,censeo-15,v#01009821,93395,"ACT, PAT",ita censeo: publicandas eorum pecunias,,,,,,
3297a1,censeo,v#v-w6_MPf5_MP,censeo-15,v#01009821,93395,"ACT, PAT",ita censeo: publicandas eorum pecunias,,,,,,
SlaT-3297-n2,publico,v#v-w1374_MPf1_MP,publico-03,v#02273293,120357,"ACT, PAT",publicandas eorum pecunias,,,,,,
SlaT-3297-n6,habeo,v#v-w73_MPf18_MP,habeo-NEW-25,v#02681795,105044,"ACT, PAT, EFF",ipsos in vinculis habendos,"keep in a certain state, position, or activity; e.g.,",,,,,
SlaT-3297-n9,valeo,v#v-w622_MPf5_MP,ualeo-04,v#02204692,129509,ACT,"municipia, quae maxume opibus valent",,,,does not match with same frame elsewhere,,
3298a1,censeo,v#v-w6_MPf7_MP,censeo-15,v#01009821,93395,"ACT, PAT",ita censeo: publicandas eorum pecunias,,,,,,
SlaT-3298-n3,refero,v#v-w566_MPf11_MP,refero-09,v#00965035,122494,"ACT, PAT",quis de iis postea ad senatum referat,,,,,,
SlaT-3298-n8,ago,v#v-w250_MPf7_MP,08-06,v#00813978,88140,"ACT, PAT, REG",cum populo agat,,,,,,
3299a1,censeo,v#v-w6_MPf8_MP,censeo-15,v#01009821,93395,"ACT, PAT",ita censeo: publicandas eorum pecunias,,,,,,
SlaT-3299-n1,existimo,v#v-w591_MPf10_MP,existimo-03,v#00689344,102057,"ACT, EFF, PAT",senatum existumare eum contra rem publicam et salutem omnium facturum,,,,,,
SlaT-3299-n3,facio,v#v-w76_MPf43_MP,facio-23,v#01712704,102758,"ACT, PAT",eum contra rem publicam et salutem omnium facturum,,,,,,
SlaT-3299-n5,facio,v#v-w76_MPf43_MP,facio-23,v#01712704,102758,"ACT, PAT",qui aliter fecerit,,,,,,
